<?xml version="1.0" encoding="UTF-8"?>
<serie xmlns:xsi="http://www.w3.org/2001/XMLSchema-instance"
 xsi:noNamespaceSchemaLocation="fichas1.xsd">
    <ficha>
        <nombre></nombre>
        <apellido1></apellido1>
        <apellido2></apellido2>
        <email></email>
        <direccion>
            <calle></calle>
            <piso></piso>
            <letra></letra>
            <cp></cp>
            <ciudad></ciudad>
            <pais></pais>
        </direccion>
    </ficha>
</serie>